[
  {
    "timestamp": "2025-06-19T13:00:00Z",
    "wallet": "0xdeadbeef0000",
    "origin_type": "Wallet",
    "origin_label": "CustUser-A1",
    "to": "0xprotocoldest000",
    "protocol_type": "Liquidity Hub",
    "token": "wETH",
    "value": null,
    "action": "Transfer",
    "risk_score": 48,
    "flags": [
      "FLG-MIXER-002",
      "FLG-SYBIL-001"
    ],
    "verdict": "BLOCK",
    "justification": "Risco elevado detectado por m\u00faltiplas flags cr\u00edticas."
  },
  {
    "timestamp": "2025-06-19T13:05:00Z",
    "wallet": "0xdeadbeef0001",
    "origin_type": "CEX",
    "origin_label": "CEX-Binance-KYC",
    "to": "0xprotocoldest001",
    "protocol_type": "Shield",
    "token": "SilentUSD",
    "value": null,
    "action": "Approve",
    "risk_score": 80,
    "flags": [
      "FLG-BOT-SIGNATURE-009"
    ],
    "verdict": "BLOCK",
    "justification": "Risco elevado detectado por m\u00faltiplas flags cr\u00edticas."
  },
  {
    "timestamp": "2025-06-19T13:10:00Z",
    "wallet": "0xdeadbeef0002",
    "origin_type": "Contract",
    "origin_label": "SmartWallet-Railgun",
    "to": "0xprotocoldest002",
    "protocol_type": "Shield",
    "token": "wETH",
    "value": null,
    "action": "Swap",
    "risk_score": 86,
    "flags": [
      "FLG-OBFUSCATED-004"
    ],
    "verdict": "REVIEW",
    "justification": "Comportamento at\u00edpico identificado; an\u00e1lise manual recomendada."
  },
  {
    "timestamp": "2025-06-19T13:15:00Z",
    "wallet": "0xdeadbeef0003",
    "origin_type": "Mixer",
    "origin_label": "Obfuscator-X",
    "to": "0xprotocoldest003",
    "protocol_type": "ZK Rollup",
    "token": "Railbyte",
    "value": 186.62,
    "action": "Approve",
    "risk_score": 48,
    "flags": [
      "FLG-OBFUSCATED-004"
    ],
    "verdict": "REVIEW",
    "justification": "Comportamento at\u00edpico identificado; an\u00e1lise manual recomendada."
  },
  {
    "timestamp": "2025-06-19T13:20:00Z",
    "wallet": "0xdeadbeef0004",
    "origin_type": "DAO",
    "origin_label": "NightDAO-Multisig",
    "to": "0xprotocoldest004",
    "protocol_type": "DAO",
    "token": "NovaSett",
    "value": null,
    "action": "Transfer",
    "risk_score": 57,
    "flags": [
      "FLG-OBFUSCATED-004"
    ],
    "verdict": "REVIEW",
    "justification": "Comportamento at\u00edpico identificado; an\u00e1lise manual recomendada."
  },
  {
    "timestamp": "2025-06-19T13:25:00Z",
    "wallet": "0xdeadbeef0005",
    "origin_type": "Stealth",
    "origin_label": "StealthChain-ZK",
    "to": "0xprotocoldest005",
    "protocol_type": "DAO",
    "token": "SilentUSD",
    "value": null,
    "action": "Transfer",
    "risk_score": 81,
    "flags": [],
    "verdict": "ALLOW",
    "justification": "Nenhuma anomalia cr\u00edtica identificada. Permiss\u00e3o concedida."
  },
  {
    "timestamp": "2025-06-19T13:30:00Z",
    "wallet": "0xdeadbeef0006",
    "origin_type": "Bridge",
    "origin_label": "ZKBridge-Relay",
    "to": "0xprotocoldest006",
    "protocol_type": "Shield",
    "token": "NovaSett",
    "value": 204.8,
    "action": "Swap",
    "risk_score": 88,
    "flags": [
      "FLG-BOT-SIGNATURE-009"
    ],
    "verdict": "ALLOW",
    "justification": "Nenhuma anomalia cr\u00edtica identificada. Permiss\u00e3o concedida."
  },
  {
    "timestamp": "2025-06-19T13:35:00Z",
    "wallet": "0xdeadbeef0007",
    "origin_type": "Bot",
    "origin_label": "Botnet-Control-Y",
    "to": "0xprotocoldest007",
    "protocol_type": "Liquidity Hub",
    "token": "USDC",
    "value": 359.67,
    "action": "Transfer",
    "risk_score": 77,
    "flags": [
      "FLG-MIXER-002",
      "FLG-SYBIL-001"
    ],
    "verdict": "ALLOW",
    "justification": "Nenhuma anomalia cr\u00edtica identificada. Permiss\u00e3o concedida."
  },
  {
    "timestamp": "2025-06-19T13:40:00Z",
    "wallet": "0xdeadbeef0008",
    "origin_type": "CEX",
    "origin_label": "CEX-KuCoin-KYC",
    "to": "0xprotocoldest008",
    "protocol_type": "DEX",
    "token": "NovaSett",
    "value": 436.58,
    "action": "Stake",
    "risk_score": 52,
    "flags": [],
    "verdict": "REVIEW",
    "justification": "Comportamento at\u00edpico identificado; an\u00e1lise manual recomendada."
  },
  {
    "timestamp": "2025-06-19T13:45:00Z",
    "wallet": "0xdeadbeef0009",
    "origin_type": "Wallet",
    "origin_label": "PowerUser-Z",
    "to": "0xprotocoldest009",
    "protocol_type": "DAO",
    "token": "Railbyte",
    "value": 124.52,
    "action": "Swap",
    "risk_score": 79,
    "flags": [
      "FLG-BOT-SIGNATURE-009"
    ],
    "verdict": "ALLOW",
    "justification": "Nenhuma anomalia cr\u00edtica identificada. Permiss\u00e3o concedida."
  },
  {
    "timestamp": "2025-06-19T13:50:00Z",
    "wallet": "0xdeadbeef0010",
    "origin_type": "Contract",
    "origin_label": "VaultExecutor-V2",
    "to": "0xprotocoldest010",
    "protocol_type": "Mixer",
    "token": "SilentUSD",
    "value": 278.72,
    "action": "Approve",
    "risk_score": 45,
    "flags": [],
    "verdict": "BLOCK",
    "justification": "Risco elevado detectado por m\u00faltiplas flags cr\u00edticas."
  },
  {
    "timestamp": "2025-06-19T13:55:00Z",
    "wallet": "0xdeadbeef0011",
    "origin_type": "Wallet",
    "origin_label": "CustUser-X",
    "to": "0xprotocoldest011",
    "protocol_type": "CEX",
    "token": "USDC",
    "value": 329.0,
    "action": "Approve",
    "risk_score": 78,
    "flags": [
      "FLG-BRIDGE-DARK-007"
    ],
    "verdict": "ALLOW",
    "justification": "Nenhuma anomalia cr\u00edtica identificada. Permiss\u00e3o concedida."
  },
  {
    "timestamp": "2025-06-19T14:00:00Z",
    "wallet": "0xdeadbeef0012",
    "origin_type": "DAO",
    "origin_label": "DeFiGov-Node7",
    "to": "0xprotocoldest012",
    "protocol_type": "ZK Rollup",
    "token": "Railbyte",
    "value": 407.4,
    "action": "Stake",
    "risk_score": 52,
    "flags": [
      "FLG-ZK-ANON-003"
    ],
    "verdict": "REVIEW",
    "justification": "Comportamento at\u00edpico identificado; an\u00e1lise manual recomendada."
  },
  {
    "timestamp": "2025-06-19T14:05:00Z",
    "wallet": "0xdeadbeef0013",
    "origin_type": "Bridge",
    "origin_label": "DarkBridge-Gamma",
    "to": "0xprotocoldest013",
    "protocol_type": "Vault",
    "token": "SilentUSD",
    "value": 174.47,
    "action": "Stake",
    "risk_score": 60,
    "flags": [
      "FLG-BOT-SIGNATURE-009"
    ],
    "verdict": "BLOCK",
    "justification": "Risco elevado detectado por m\u00faltiplas flags cr\u00edticas."
  },
  {
    "timestamp": "2025-06-19T14:10:00Z",
    "wallet": "0xdeadbeef0014",
    "origin_type": "Wallet",
    "origin_label": "GhostWallet-33",
    "to": "0xprotocoldest014",
    "protocol_type": "Aggregator",
    "token": "Railbyte",
    "value": null,
    "action": "Approve",
    "risk_score": 82,
    "flags": [
      "FLG-DAO-SPAM-005"
    ],
    "verdict": "ALLOW",
    "justification": "Nenhuma anomalia cr\u00edtica identificada. Permiss\u00e3o concedida."
  }
]